text,contextual_chunk
"{'event_name': 'Bathe Alone', 'location': 'The Funhouse @ Mr. Smalls', 'description': 'Mr. Smalls Presents\nBathe Alone\nSpecial Guest: Valleyview\nDoors: 7:00 pm / Show: 8:00 pm\nBathe Alone is the dream pop moniker of multi-instrumentalist Bailey Crone. Taking shape in Atlanta, her haunting approach to songwriting and delicate vocal deliveries often draw comparisons to Beach House, Mitski, and The xx.\n6034337465', 'price': 'Advance: $15.00 - Day Of Show: $20.00'}","A dream pop performance by Bailey Crone at Mr. Smalls, featuring special guest Valleyview."
"{'event_name': ""Stymo The Band - Pittsburgh's Premier Cover Band"", 'location': 'Hard Rock Cafe', 'description': ""Hard Rock Cafe and CE Presents welcome Stymo The Band - Pittsburgh's Premier Cover Band on Thursday, October 17, 2024! Entry and seating for event attendees begin at 7:00 PM. General Admission tickets are required for entry and are available for purchase at Eventbrite.com. Seating within the event is available on a first-come, first-served basis. General Admission tickets do not reserve a seat. If you require accessible seating accommodations, you must notify the venue in advance. This event is open to all ages with alcohol available for purchase to attendees ages 21 and over.\n412-481-7625"", 'price': '$15.00'}","Stymo The Band, a cover band from Pittsburgh, will perform at Hard Rock Cafe on October 17, 2024, with general admission tickets available for $15."
"{'event_name': 'Books in the Afternoon', 'location': 'Carnegie Library, Oakland', 'description': 'Lively discussions of contemporary fiction.\n412-622-3114'}",A lively discussion of contemporary fiction at the Carnegie Library in Oakland.
"{'event_name': 'Green Drinks: Sunrise Movement Pittsburgh', 'location': 'Fuel & Fuddle', 'description': 'Green Drinks is a monthly, social event for people who care about the environment. February Green Drinks is hosted by Sunrise Movement Pittsburgh. Come learn more about their mission ""to pressure elected officials to support a select committee on a Green New Deal and to promise to receive no donations from the fossil fuel industry."" Add your voice to the movement! This event is organized by the Pittsburgh Chapter of Citizens\' Climate Lobby. Under 21 are welcome. Light snacks provided.\n412-682-3473'}","Green Drinks: Sunrise Movement Pittsburgh is a monthly environmental awareness event hosted by the Pittsburgh Chapter of Citizens' Climate Lobby, featuring a discussion on supporting a Green New Deal and welcoming under 21 attendees."
"{'event_name': 'Reggae Night', 'location': 'Allegheny City Brewing', 'description': 'Original roots, reggae, dancehall and dub records selected alongside delicious craft beer! Caribbean Vybz food truck will be providing the itals.\n412-904-3732', 'price': 'Free!'}",Reggae Night at Allegheny City Brewing featuring Caribbean Vybz food truck and free craft beer.
"{'event_name': 'Senator John Heinz History Center', 'location': 'Senator John Heinz History Center', 'description': 'Ongoing: Western PA Sports Museum, Clash of Empires, & exhibits on local history, more.\n412-454-6000', 'date': 'Ongoing'}",The Senator John Heinz History Center is an ongoing venue with exhibits on Western PA sports and local history.
"{'date': 'Jan 31, 2024 | 6:30 pm - 7:30 pm', 'description': 'Get the inside scoop on the PNC Broadway in Pittsburgh performances with Creative Conversations presented by the Trust Arts Education Department.', 'category': 'Arts + Culture,, Workshops & Classes', 'venue': 'Trust Arts Education Center 807 Liberty Ave Pittsburgh, PA 15222', 'more_details': '', 'event_name': 'Creative Conversations - My Fair Lady'}","Creative Conversations presents ""My Fair Lady"" at the Trust Arts Education Center."
"{'date': 'Jan 31, 2024 | 6:00 pm - 8:00 pm', 'description': 'Radiant Strings is a Pittsburgh-based string ensemble comprised of classically trained musicians and is the ideal blend of classical refinement, modern edge and an infectious energy.', 'category': 'Free event,, Music', 'venue': 'Greer Cabaret Theater 655 Penn Ave Pittsburgh, PA 15222', 'more_details': '', 'event_name': 'Radiant Strings'}","Radiant Strings is a Pittsburgh-based string ensemble featuring classically trained musicians, offering a blend of classical refinement, modern edge, and infectious energy."
"{'date': 'Jan 31, 2024 | 6:00 pm - 8:30 pm', 'description': 'Best Restaurants is a wonderful opportunity to try samples from restaurants you may have never been to or heard of before!', 'category': 'Community', 'venue': 'David L. Lawrence Convention Center 1000 Fort Dusquene Boulevard Pittsburgh, PA 15222', 'more_details': 'Join the Downtown Neighbors Alliance January 31 from 6 - 8:30 p.m. and experience divine downtown cuisine at the David L. Lawrence Convention Center! This event will feature over 30 of Greater Downtown Pittsburgh’s best restaurants and showcase free bite-size samples of one or more of their finest dishes. Whether you are new to the greater downtown area or have been a resident for years, Best Restaurants is a wonderful opportunity to try samples from restaurants you may have never been to or heard of before! This is an event you don’t want to miss! Tell your friends, family, coworkers and more to join you for a delicious time! We hope to see you and the rest of the downtown community there!', 'event_name': 'Best Restaurants'}",Best Restaurants is an event at the David L. Lawrence Convention Center featuring free bite-size samples from over 30 of Greater Downtown Pittsburgh's best restaurants.
"{'date': 'Jan 30, 2024 | 5:00 pm - 7:00 pm', 'description': 'The BNY Mellon presents JazzLive series features Daniel and Benjamin May Trio with Grace Elliott, presented by the Pittsburgh Cultural Trust in partnership with MCG Jazz.', 'category': 'Entertainment,, Free event,, Music', 'venue': 'Greer Cabaret Theater 655 Penn Ave Pittsburgh, PA 15222', 'more_details': ""Daniel May | Daniel May studied music composition at the University of Connecticut, where he received a master’s degree in music composition and music theory. He then went to Ithaca, New York, to study music composition at Cornell University. After earning a Doctor of Musical Arts degree composer for feature films, television and, most notably, IMAX films. Career highlights include his score to the award-winning IMAX film Everest. In his film scores, Daniel has collaborated with George Harrison (Everest), Sting (The Living Seas and Dolphins), Lindsay Buckingham (Adventures in Wild California), and The Moody Blues (Journey into Amazing Caves). Additionally, May is a jazz pianist and has recorded extensively with some of the world's foremost jazz artists. During his career, May has produced and recorded more than 50 CD projects. Benjamin May | After many years of classical training, Benjamin May moved to the Los Angeles area to pursue performing full time. After 30 years and 14,000+ performances, Benjamin has amassed a great deal of real-life on-stage experience that he uses to add richness and depth to his performances. In addition, he has worked as an instrumental aid, full time, for over twenty years in Long Beach Unified School District. In 2023 Benjamin relocated from Los Angeles to Pittsburgh and has quickly become integrated into the Pittsburgh jazz scene, keeping a very active performance schedule.  As a freelance jazz musician, Benjamin has worked with countless singers and music groups ranging from full big bands or symphony orchestras, and small combos like quintets or as small as a duo. Some notables include: Joe Pass, Rosemary Clooney, Anita O’Day, Annie Ross, Bonnie Raitt, Ben Vereen, Bill Henderson, Barbara Morrison, Llew Matthews, Johnny Crawford, Bill Elliot, Al Viola, Frank Sinatra Jr., Seth MacFarlane, just to name a few. Benjamin has also opened for Joe Zawinul, and Tony Bennett. As a recording artist, Benjamin has recorded on over 40 CDs for various artists and projects. Grace Elliott | Grace Elliott is a vocalist and songwriter born and raised in Pittsburgh. She graduated from North Allegheny and attended the Frost school of music for Vocal Jazz Performance. At 20 years old she is a full time musician performing around the city of Pittsburgh and is currently working on original music. George Heid III | George's earliest studies took place at the Afro American Music Institute where he studied with Thomas Wendt and James Johnson III. Later George would graduate from Pittsburgh’s Creative and Performing Arts high school, where he was mentored by jazz drumming legend Roger Humphries. After high school, he studied at Pittsburgh’s Duquesne University as well as at State University of New York: Purchase, where he studied with master jazz drummers Kenny Washington, John Riley and Richie Morales. George has toured and played at numerous notable jazz venues across the United States and China, including three multi-month residencies in Hangzhou, China. George is the recipient of numerous awards as both a performer and composer, including the 2013 ASCAP Young Jazz Composer Award, Downbeat magazine’s 2013 Best Original Jazz Composition award, and back-to-back Outstanding Soloist awards at the Monterey Next Generation Jazz Festival awards in 2011 and 2012."", 'event_name': 'Daniel and Benjamin May Trio with Grace Elliott'}","The BNY Mellon presents JazzLive series featuring Daniel May, Benjamin May, and Grace Elliott."
"{'date': 'Jan 30, 2024 | 7:30 pm - 9:30 pm', 'description': 'The PSO will “Rock You” in this exploration of Queen’s epic masterpieces, led by Finnish a cappella ensemble, Rajaton.', 'category': 'Arts + Culture,, Music', 'venue': 'Heinz Hall 600 Penn Ave Pittsburgh, PA 15222', 'more_details': '', 'event_name': 'Rajaton Sings Queen'}","Rajaton, a Finnish a cappella ensemble, will perform Queen's iconic songs at Heinz Hall."
"{'date': 'Jan 30, 2024 - Feb 4, 2024', 'description': 'From Lincoln Center Theater that brought you The King & I and South Pacific, comes “a sumptuous new production of the most perfect musical of all time” (Entertainment Weekly), Lerner & Loewe’s MY FAIR LADY.', 'category': 'Arts + Culture,, Entertainment,, Music', 'venue': 'Benedum Center 7th St and Penn Ave Pittsburgh, PA 15222', 'more_details': 'Director Bartlett Sher’s glowing production is “thrilling, glorious and better than it ever was” (New York Times). “Every so often a revival comes along that reminds you how indispensable great theater can be” (NY1). Boasting such classic songs as “I Could Have Danced All Night,” “The Rain in Spain,” “Wouldn’t It Be Loverly” and “On the Street Where You Live,” MY FAIR LADY tells the story of Eliza Doolittle, a young Cockney flower seller, and Henry Higgins, a linguistics professor who is determined to transform her into his idea of a “proper lady.” But who is really being transformed?', 'event_name': 'My Fair Lady'}","MY FAIR LADY, a sumptuous new production of the timeless musical by Lerner & Loewe, features classic songs and tells the story of Eliza Doolittle's transformation into a ""proper lady"" through the efforts of linguistics professor Henry Higgins."
"{'date': 'Jan 30, 2024 - Feb 4, 2024', 'description': 'From Lincoln Center Theater that brought you The King & I and South Pacific, comes “a sumptuous new production of the most perfect musical of all time” (Entertainment Weekly), Lerner & Loewe’s MY FAIR LADY.', 'category': 'Arts + Culture,, Entertainment,, Music', 'venue': 'Benedum Center 7th St and Penn Ave Pittsburgh, PA 15222', 'more_details': 'Director Bartlett Sher’s glowing production is “thrilling, glorious and better than it ever was” (New York Times). “Every so often a revival comes along that reminds you how indispensable great theater can be” (NY1). Boasting such classic songs as “I Could Have Danced All Night,” “The Rain in Spain,” “Wouldn’t It Be Loverly” and “On the Street Where You Live,” MY FAIR LADY tells the story of Eliza Doolittle, a young Cockney flower seller, and Henry Higgins, a linguistics professor who is determined to transform her into his idea of a “proper lady.” But who is really being transformed?', 'event_name': 'My Fair Lady'}","MY FAIR LADY, a sumptuous new production of the timeless musical by Lerner & Loewe, features classic songs and tells the story of Eliza Doolittle's transformation into a ""proper lady"" through the efforts of linguistics professor Henry Higgins."
"{'date': 'Jan 29, 2024 | 3:00 pm - 5:00 pm', 'description': 'For small and diverse businesses, the opportunity to sell goods and services globally has never been more accessible. This incredible opportunity comes from the worldwide appreciation for products and services made in the USA. Make sure to register for this FREE event!', 'category': 'Arts + Culture,, Free event,, Workshops & Classes', 'venue': 'The Pop District 106 Isabella St Floor 7 Pittsburgh, PA 15212', 'more_details': ""It's time to expand your reach and Go Global! Enjoy snacks, and beverages, and explore the possibilities of expanding your business on a global scale! For small and diverse businesses, the chance to take your goods and services global has never been more accessible! Our seminar is designed to cater to manufacturing, technology, and service companies eager to expand their export sales beyond borders. This seminar will cover topics including: Join us for insights from industry experts: Event Details: Date: Monday, January 29, 2024 Time: 3:00-5:00 pm Location: The Pop District 106 Isabella St FL 7, Pittsburgh, PA 15212 Cost: No fee *Key Code to enter The Pop District will be emailed to registrants 1 day before event* This event, in partnership with University of Pittsburgh SBDC, U.S. Department of Commerce - Commercial Service, Southwestern PA Commission, RL Swearer Freight Forwarders, Small Business Administration Export Financing, is your gateway to global expansion."", 'event_name': 'GO GLOBAL - Make The World Your Market'}","A free event on January 29, 2024, at The Pop District in Pittsburgh, PA, to help small and diverse businesses expand their global market through insights from industry experts."
"{'date': 'Jan 28, 2024 | 2:00 pm - 4:00 pm', 'description': 'In the aftermath of the Trojan War, the priestess Iphigénie is tasked to kill any strangers who land on Scythia’s shores. But as Fate would have it, her brother Oreste is the first to be shipwrecked on the peninsula and brought to the sacrificial altar.', 'category': 'Arts + Culture,, Entertainment,, Music', 'venue': 'CAPA Theater 111 9th St Pittsburgh, PA 15222', 'more_details': 'The priestess believes her brother to be dead and responsible for the death of their mother. Oreste in turn believes that Iphigénie had been sacrificed to the goddess Diana by their father Agamemnon in return for favorable winds. The siblings fail to recognize each other yet Iphigénie feels a strange kinship with the ill-fated stranger. She wishes to spare him, but Oreste—driven mad by grief and guilt over his family’s compounding tragedy—welcomes death. Will they discover the truth before it is too late? Showcasing the transition from baroque to classical opera, Christoph Gluck reimagines Euripides’ great Greek drama and reignites it in true operatic form.', 'event_name': 'IPHIGÉNIE EN TAURIDE'}","IPHIGÉNIE EN TAURIDE is a classical opera adaptation of Euripides' play, featuring Christoph Gluck's reinterpretation of the story set against the backdrop of the Trojan War."
"{'date': 'Jan 26, 2024 | 7:30 pm - 9:30 pm', 'description': 'In the aftermath of the Trojan War, the priestess Iphigénie is tasked to kill any strangers who land on Scythia’s shores. But as Fate would have it, her brother Oreste is the first to be shipwrecked on the peninsula and brought to the sacrificial altar.', 'category': 'Arts + Culture,, Entertainment,, Music', 'venue': 'CAPA Theater 111 9th St Pittsburgh, PA 15222', 'more_details': 'The priestess believes her brother to be dead and responsible for the death of their mother. Oreste in turn believes that Iphigénie had been sacrificed to the goddess Diana by their father Agamemnon in return for favorable winds. The siblings fail to recognize each other yet Iphigénie feels a strange kinship with the ill-fated stranger. She wishes to spare him, but Oreste—driven mad by grief and guilt over his family’s compounding tragedy—welcomes death. Will they discover the truth before it is too late? Showcasing the transition from baroque to classical opera, Christoph Gluck reimagines Euripides’ great Greek drama and reignites it in true operatic form.', 'event_name': 'IPHIGÉNIE EN TAURIDE'}","IPHIGÉNIE EN TAURIDE is a musical adaptation of Euripides' play, featuring Christoph Gluck's reinterpretation of the story set against the backdrop of classical and baroque opera transitions."
"{'date': 'Jan 23, 2024 | 7:00 pm - 9:00 pm', 'description': 'In the aftermath of the Trojan War, the priestess Iphigénie is tasked to kill any strangers who land on Scythia’s shores. But as Fate would have it, her brother Oreste is the first to be shipwrecked on the peninsula and brought to the sacrificial altar.', 'category': 'Arts + Culture,, Entertainment,, Music', 'venue': 'CAPA Theater 111 9th St Pittsburgh, PA 15222', 'more_details': 'The priestess believes her brother to be dead and responsible for the death of their mother. Oreste in turn believes that Iphigénie had been sacrificed to the goddess Diana by their father Agamemnon in return for favorable winds. The siblings fail to recognize each other yet Iphigénie feels a strange kinship with the ill-fated stranger. She wishes to spare him, but Oreste—driven mad by grief and guilt over his family’s compounding tragedy—welcomes death. Will they discover the truth before it is too late? Showcasing the transition from baroque to classical opera, Christoph Gluck reimagines Euripides’ great Greek drama and reignites it in true operatic form.', 'event_name': 'IPHIGÉNIE EN TAURIDE'}","IPHIGÉNIE EN TAURIDE is a musical adaptation of Euripides' play, featuring Christoph Gluck's reinterpretation of the story set against the backdrop of classical and baroque opera transitions."
"{'date': 'Jan 20, 2024 | 8:00 pm - 10:00 pm', 'description': 'In the aftermath of the Trojan War, the priestess Iphigénie is tasked to kill any strangers who land on Scythia’s shores. But as Fate would have it, her brother Oreste is the first to be shipwrecked on the peninsula and brought to the sacrificial altar.', 'category': 'Arts + Culture,, Entertainment,, Music', 'venue': 'CAPA Theater 111 9th St Pittsburgh, PA 15222', 'more_details': 'The priestess believes her brother to be dead and responsible for the death of their mother. Oreste in turn believes that Iphigénie had been sacrificed to the goddess Diana by their father Agamemnon in return for favorable winds. The siblings fail to recognize each other yet Iphigénie feels a strange kinship with the ill-fated stranger. She wishes to spare him, but Oreste—driven mad by grief and guilt over his family’s compounding tragedy—welcomes death. Will they discover the truth before it is too late? Showcasing the transition from baroque to classical opera, Christoph Gluck reimagines Euripides’ great Greek drama and reignites it in true operatic form.', 'event_name': 'IPHIGÉNIE EN TAURIDE'}","IPHIGÉNIE EN TAURIDE is a musical adaptation of Euripides' play, featuring Christoph Gluck's reinterpretation of the story set against the backdrop of classical and baroque opera transitions."
"{'date': 'Jan 28, 2024 | 1:00 pm - 2:00 pm', 'description': 'Learn about the composer, the story, and some juicy details about the opera! These talks are free to all ticketholders.', 'category': 'Arts + Culture,, Workshops & Classes', 'venue': 'CAPA Theater 111 9th St Pittsburgh, PA 15222', 'more_details': 'Ticketholders are invited to attend a Pre-Opera Talk one hour before each performanceâ€™s curtain at all Pittsburgh Opera performances at Benedum Center, Pittsburgh CAPA School Theater, and the Byham Theater. Learn about the composer, the story, and some juicy details about the opera! These talks are free to all ticketholders.', 'event_name': 'Pre-Opera Talk'}","Pre-Opera Talk at Pittsburgh Opera venues, free for ticket holders, covering composer, story, and opera details."
"{'date': 'Jan 26, 2024 | 6:30 pm - 7:30 pm', 'description': 'Learn about the composer, the story, and some juicy details about the opera! These talks are free to all ticketholders.', 'category': 'Arts + Culture,, Workshops & Classes', 'venue': 'CAPA Theater 111 9th St Pittsburgh, PA 15222', 'more_details': 'Ticketholders are invited to attend a Pre-Opera Talk one hour before each performanceâ€™s curtain at all Pittsburgh Opera performances at Benedum Center, Pittsburgh CAPA School Theater, and the Byham Theater. Learn about the composer, the story, and some juicy details about the opera! These talks are free to all ticketholders.', 'event_name': 'Pre-Opera Talk'}","Pre-Opera Talk at Pittsburgh Opera featuring composer, story, and opera details."
"{'date': 'Jan 23, 2024 | 6:00 pm - 7:00 pm', 'description': 'Learn about the composer, the story, and some juicy details about the opera! These talks are free to all ticketholders.', 'category': 'Arts + Culture,, Workshops & Classes', 'venue': 'CAPA Theater 111 9th St Pittsburgh, PA 15222', 'more_details': 'Ticketholders are invited to attend a Pre-Opera Talk one hour before each performanceâ€™s curtain at all Pittsburgh Opera performances at Benedum Center, Pittsburgh CAPA School Theater, and the Byham Theater. Learn about the composer, the story, and some juicy details about the opera! These talks are free to all ticketholders.', 'event_name': 'Pre-Opera Talk'}","Pre-Opera Talk at Pittsburgh Opera featuring composer, story, and opera details."
"{'date': 'Jan 20, 2024 | 7:00 pm - 8:00 pm', 'description': 'Learn about the composer, the story, and some juicy details about the opera! These talks are free to all ticketholders.', 'category': 'Arts + Culture,, Workshops & Classes', 'venue': 'CAPA Theater 111 9th St Pittsburgh, PA 15222', 'more_details': 'Ticketholders are invited to attend a Pre-Opera Talk one hour before each performanceâ€™s curtain at all Pittsburgh Opera performances at Benedum Center, Pittsburgh CAPA School Theater, and the Byham Theater. Learn about the composer, the story, and some juicy details about the opera! These talks are free to all ticketholders.', 'event_name': 'Pre-Opera Talk'}","Pre-Opera Talk at Pittsburgh Opera featuring composer, story, and opera details."
"{'date': 'Apr 30, 2024 | 6:00 pm - 7:00 pm', 'description': 'Ticketholders are invited to attend a Pre-Opera Talk one hour before each performance’s curtain at all Pittsburgh Opera performances at Benedum Center, Pittsburgh CAPA School Theater, and the Byham Theater.', 'category': 'Arts + Culture,, Workshops & Classes', 'venue': 'Byham Theater 101 6th St Pittsburgh, PA 15222', 'more_details': 'Learn about the composer, the story, and some juicy details about the opera! These talks are free to all ticketholders.', 'event_name': 'Pre-Opera Talk'}",Pre-Opera Talk at Byham Theater: Free talk for all ticket holders before each Pittsburgh Opera performance.
"{'date': 'Apr 27, 2024 | 7:00 pm - 8:00 pm', 'description': 'Learn about the composer, the story, and some juicy details about the opera! These talks are free to all ticketholders.', 'category': 'Arts + Culture,, Workshops & Classes', 'venue': 'Byham Theater 101 6th St Pittsburgh, PA 15222', 'more_details': 'Ticketholders are invited to attend a Pre-Opera Talk one hour before each performanceâ€™s curtain at all Pittsburgh Opera performances at Benedum Center, Pittsburgh CAPA School Theater, and the Byham Theater.', 'event_name': 'Pre-Opera Talk'}","Pre-Opera Talk at Byham Theater: Free Talk on Composer, Story, and Opera Details"
"{'date': 'May 3, 2024 | 6:30 pm - 7:30 pm', 'description': 'Learn about the composer, the story, and some juicy details about the opera!', 'category': '', 'venue': 'Byham Theater 2425 Liberty Ave Pittsburgh, PA 15222', 'more_details': 'Ticketholders are invited to attend a Pre-Opera Talk 45 minutes before each performance’s curtain the Byham Theater. Learn about the composer, the story, and some juicy details about the opera! These talks are free to all ticketholders.', 'event_name': 'Pre-Opera Talk'}","A Pre-Opera Talk at Byham Theater discussing the composer, story, and opera details."
"{'date': 'Jan 27, 2024 | 8:00 pm - 11:00 pm', 'description': 'Parker Amsel & Nancy Xu will be joining us from Cleveland teaching two intermediate workshops and a beginner workshop', 'category': 'Arts + Culture,, Nightlife,, Workshops & Classes', 'venue': 'CrossBody Dance & Movement 422 Wood Street Pittsburgh, PA 15222', 'more_details': ""Save the date! Join us on Saturday, January 27 for a Day of Zouk. Parker Amsel & Nancy Xu will be joining us from Cleveland teaching two intermediate workshops and a beginner workshop (details coming soon)! Practice your new skills at the social immediately following. New to Zouk or an experienced dancer - all are welcome! $40 for a full pass (price incudes social) $20 for a 'beginner bundle' - 1 beginner workshop plus the social $15 per individual workshop $10 social only"", 'event_name': 'Day of Zouk'}",Day of Zouk: Intermediate and Beginner Workshops with Parker Amsel & Nancy Xu in Pittsburgh.
