text,contextual_chunk
"{'event_name': 'Voices for Animals of Western PA', 'location': None, 'description': 'Animal advocacy, rescue and adoption and environmental work.\n877-321-4VFA'}","Voices for Animals of Western PA is an animal advocacy, rescue, and adoption organization focused on environmental work."
"{'event_name': ""St. Anthony's Chapel"", 'location': ""St. Anthony's Chapel"", 'description': 'Features 5,000 relics of Catholic saints.\n412-323-9504'}","St. Anthony's Chapel features 5,000 relics of Catholic saints and can be reached at 412-323-9504."
"{'event_name': 'Riding for the Handicapped', 'location': None, 'description': 'Seeking staff for the Therapeutic Riding Program. Knowledge of horses is not necessary.\n412-364-9444'}",Therapeutic Riding Program seeking staff for handicapped riders.
"{'event_name': 'Independent Film Night', 'location': 'DV8 Espresso Bar & Gallery', 'description': 'Submit your film, 10 minutes or less. Screenings held on the second Thursday of every month.\n724-219-0804'}","Independent Film Night at DV8 Espresso Bar & Gallery, screening 10-minute films on the second Thursday of each month."
"{'event_name': 'National Aviary', 'location': 'National Aviary', 'description': 'Home to more than 600 birds from over 200 species. W/ classes, lectures, demos & more.\n412-323-7235'}",National Aviary is a bird sanctuary with over 600 species of birds from 200 species.
"{'event_name': 'Pittsburgh History & Landmarks Foundation', 'location': None, 'description': 'Training docents for children and adult tours.\n412-471-5808 x527'}",Pittsburgh History & Landmarks Foundation offers training for docents for children and adult tours.
"{'event_name': 'Venture Outdoors', 'location': None, 'description': 'Sponsoring a wide array of outdoor activities, including rock-climbing, nature walks, fishing, kayaking, canoeing, biking and more at various venues around the region.\n412-255-0564'}",Venture Outdoors sponsors outdoor activities in various venues around the region.
"{'event_name': 'Goodwill Literacy Initiative', 'location': None, 'description': 'Seeking tutors for math, writing & English as a Second Language. Free tutor training available.\n412-390-2308'}","Goodwill Literacy Initiative seeks tutors for math, writing, and ESL with free training available."
"{'event_name': 'Assemble', 'location': 'Assemble', 'description': 'Seeking volunteers for after school & Saturday programs. Come make with kids w/ science, technology & art.\n412-254-4230'}","Volunteers needed for after school and Saturday programs focusing on science, technology, and art."
"{'event_name': 'Youth Outreach Union', 'location': None, 'description': 'Young-adult survivors of mental illness needed to support their peers. (Ages 14-27.)\n412-391-1430'}",A youth outreach union for young adults aged 14-27 who have survived mental illness.
"{'event_name': 'Big Brothers/Big Sisters of Greater Pittsburgh', 'location': None, 'description': 'Adults to mentor young people from single-parent and at-risk homes.\n412-363-6100'}","Summary: The document provides information about Big Brothers/Big Sisters of Greater Pittsburgh, an organization offering adult mentors for young people from single-parent and at-risk homes."
"{'event_name': 'Free Ride! Recycled Bike Collective', 'location': 'Free Ride!', 'description': 'Volunteers & bike mechanics needed to staff weekly open shop hours & assist the general public earn bicycles & repair their own.\n412-254-3774'}",Volunteers and bike mechanics needed for a weekly open shop to earn bicycles and repair them.
"{'event_name': 'Pittsburgh Quarterly', 'location': 'Pittsburgh Quartley', 'description': 'Looking for new work by local poets. Please check out Robert\'s poem ""Home Movies"" at '}",The document is about an event looking for new work by local poets.
"{'event_name': 'Senator John Heinz History Center', 'location': 'Senator John Heinz History Center', 'description': 'Become a volunteer, tour guide, or concierge. Contact Sandra Baker.\n412-454-6412'}",Contact Sandra Baker for volunteer opportunities at Senator John Heinz History Center.
"{'event_name': 'The Neighborhood Academy', 'location': None, 'description': 'Educational program for low-income students. Garfield.\n412-362-2001'}",Educational program for low-income students.
"{'event_name': 'POWER', 'location': None, 'description': 'Help women recovering from alcohol and other drug addictions. Swissvale.\n412-271-0500 x125'}",A hotline for women recovering from alcohol and drug addiction in Switzerland.
"{'event_name': 'The Lost Artists of the 1893 Chicago Exhibition.', 'location': 'Eclectic Art & Objects Gallery', 'description': 'Collectors Showcase.\n412-734-2099'}",The Lost Artists of the 1893 Chicago Exhibition was a collectors showcase at the Eclectic Art & Objects Gallery.
"{'event_name': 'Fort Pitt Museum', 'location': 'Fort Pitt Museum', 'description': 'Reconstructed fort houses museum of Pittsburgh history circa French & Indian War & American Revolution.\n412-281-9285'}",Fort Pitt Museum is a reconstructed fort housing a museum of Pittsburgh history during the French & Indian War and American Revolution.
"{'event_name': 'East End Community Thrift Shop', 'location': None, 'description': ""Men's, women's & children's clothing, blankets, sheets, pillows, toys, baby equipment and household items. Garfield.\n412-361-3022""}","East End Community Thrift Shop offers clothing, blankets, sheets, pillows, toys, baby equipment, and household items."
"{'event_name': 'Pittsburgh Action Against Rape', 'location': None, 'description': 'Daytime medical advocates, hotline work, special events and/or speakers bureau. South Side.\n412-431-5665'}","Pittsburgh Action Against Rape is a daytime medical advocacy, hotline work, special events, and speakers bureau organization located in South Side, Pennsylvania, with a phone number of 412-431-5665."
"{'event_name': 'Pittsburgh Sports League', 'location': None, 'description': 'Adult intramural leagues: volleyball, bowling, softball, tennis, basketball and more.\n412-338-2133'}","Adult intramural sports leagues in Pittsburgh, including volleyball, bowling, softball, tennis, and basketball."
"{'event_name': 'Gay & Lesbian Community Center', 'location': None, 'description': 'Staffers in all areas to help this service organization & staffers for the phone line. Squirrel Hill.\n412-422-0114'}",Gay & Lesbian Community Center staff available for assistance and phone support in Squirrel Hill.
"{'event_name': 'Pittsburgh Center for Creative Reuse', 'location': 'Pittsburgh Center for Creative Reuse', 'description': 'Seeking volunteers who like to work independently and are interested in art, crafts, DIY, organizing. Help is needed in the shop & assisting w/ staff run programs. Apply online.\n412-473-0100'}","Volunteers needed for art, crafts, DIY, and organizing at Pittsburgh Center for Creative Reuse."
"{'event_name': 'Pet Adoption League', 'location': None, 'description': 'Westmoreland County no-kill shelter with many puppy mill rescues seeking foster homes and volunteers for all aspects of shelter operation: dog walking, cat cuddling, fund raising, etc. Yukon, PA.\n724-953-9050'}",Westmoreland County no-kill shelter seeking foster homes and volunteers for various operations.
"{'event_name': 'Washington County Literacy Council', 'location': None, 'description': 'Tutor training sessions offered.\n724-228-6188'}",Tutor training sessions offered by Washington County Literacy Council.
"{'event_name': 'South Hills Interfaith Ministries', 'location': None, 'description': 'Tutors needed for after-school homework club. And preschool assistants.\n412-854-9120'}",Tutors needed for after-school homework club and preschool assistants.
"{'event_name': 'Nationality Rooms', 'location': 'Nationality Rooms', 'description': ""29 rooms helping to tell the story of Pittsburgh's immigrant past. University of Pittsburgh.\n412-624-6000""}",Nationality Rooms is a 29-room exhibit at the University of Pittsburgh that tells the story of Pittsburgh's immigrant past.
"{'event_name': ""Pittsburgh International Children's Theater"", 'location': None, 'description': ""Volunteers needed for Oct-March city-wide Family Series shows as well as May Children's Festival.\n412-321-5520""}",Volunteers needed for Pittsburgh International Children's Theater events in October to March and May Children's Festival.
"{'event_name': 'Citiparks Recreation Centers', 'location': None, 'description': 'Nine year-round centers in city, with programs in sports, fitness and arts. Plus individual programs and features.\n412-422-6543'}","Citiparks Recreation Centers offer nine-year-round centers with sports, fitness, and arts programs, as well as individual programs and features."
"{'event_name': 'Humane Society', 'location': None, 'description': 'Seeking dog-walkers and -trainers, cat-cuddlers, foster homes, event tables, more. North Side.\n412-321-4625 x246'}",Humane Society seeking various pet-related positions in North Side.
"{'event_name': 'YWCA Teen Services Department', 'location': None, 'description': 'Share craft, talent or profession with teens.\n412-365-1933'}","YWCA Teen Services Department offers craft, talent, or profession sharing events for teens."
"{'event_name': 'East End Cooperative Ministry', 'location': None, 'description': ""Children's tutors & mentors needed. Weekday volunteers for soup kitchen, food pantry, Meals on Wheels program.\n412-361-5549 x415""}","Volunteers needed for children's tutoring and mentoring at a soup kitchen, food pantry, and Meals on Wheels program."
"{'event_name': 'GLSEN Pittsburgh', 'location': None, 'description': 'Help raise awareness on the importance of creating safe schools, regardless of sexual orientation or gender identity. Social media, email marketing, grant writing, advocacy, fundraising. Contact Adam Pribila at[email\xa0protected].\n412-996-2326'}",GLSEN Pittsburgh event aims to promote safe schools for LGBTQ+ students through various campaigns.
"{'event_name': 'Rebuilding Together Pittsburgh', 'location': None, 'description': 'Help low income seniors who are in need of home repairs to be safe warm & happy in their own homes.\n412-922-0953'}","Rebuilding Together Pittsburgh helps low-income seniors with home repairs to ensure safety, warmth, and happiness."
"{'event_name': 'United Steelworkers’ Activist Corps', 'location': None, 'description': 'Looking for Political Activist Volunteers for member mobilization, communication, and strategic political actions. Free t-shirts, food. Downtown.\n412-562-2475'}","United Steelworkers' Activist Corps is recruiting political activist volunteers for member mobilization, communication, and strategic political actions in downtown."
"{'event_name': 'The Thomas Merton Center', 'location': None, 'description': 'Weekly packaging of books for prisoners. Plus monthly paper The New People needs staff for bulk mailing, research, distribution, more. Garfield.\n412-361-3022'}","Weekly book packaging for prisoners and monthly bulk mailing, research, and distribution assistance needed."
"{'event_name': 'Rachel Carson Homestead', 'location': None, 'description': ""Children's environmental-education programs, office duties, museum retail store, special events, gardening & outdoor projects. Springdale.\n724-274-5459""}","Rachel Carson Homestead offers children's environmental education programs, office duties, a museum retail store, special events, and gardening projects in Springdale."
"{'event_name': 'Goodwill Industries Donations', 'location': None, 'description': ""Special call for children's clothing, housewares, appliances, dishes and more. At all locations.\n412-481-9005""}","Goodwill Industries is seeking donations of children's clothing, housewares, appliances, and dishes at all locations."
"{'event_name': 'Pittsburgh AIDS Task Force', 'location': None, 'description': 'For special events, mailings, community education, client services and more. East Liberty.\n412-345-7456'}","Pittsburgh AIDS Task Force provides various services including events, mailings, community education, and client services in East Liberty."
"{'event_name': 'Red Cross CPR, First Aid Training', 'location': 'Red Cross Headquarters', 'description': 'Classes on various Tuesdays, Thursdays, Saturdays. Call for details.\n888-217-9599'}","Red Cross offers CPR and First Aid training classes on Tuesdays, Thursdays, and Saturdays."
"{'event_name': 'Three Rivers Lacrosse', 'location': None, 'description': ""Open to boys and girls, kindergarten and up, plus men's senior and post collegiate.\n412-571-2501""}","Three Rivers Lacrosse is an open event for boys, girls, kindergarten, and up, as well as men's senior and post collegiate."
"{'event_name': 'Girl Scouts Trillium Council', 'location': None, 'description': 'For short & long-term positions to assist troops in the tri-state area.\n724-435-7918'}","The document provides contact information for the Girl Scouts Trillium Council, including phone number 724-435-7918."
"{'event_name': 'American Civil Liberties Union', 'location': None, 'description': 'Seeking help in all areas. Oakland.\n412-681-7736'}",American Civil Liberties Union seeking help in Oakland.
"{'event_name': 'Interfaith Volunteer Caregivers', 'location': None, 'description': 'Seeking compassionate volunteers to assist older adults by providing rides to doctor appointments, help with grocery shopping, friendly visiting, and more!\n412-345-7420'}",Interfaith Volunteer Caregivers seeks compassionate volunteers to assist older adults with various tasks.
"{'event_name': 'Womansplace', 'location': None, 'description': 'Become advocates to end social violence against women.\n412-678-4620 x205'}",A hotline for women's advocacy to end violence against women.
"{'event_name': 'Sweetwater Art Center', 'location': None, 'description': 'To help with event preparations. Sewickley.\n412-741-4405'}",The Sweetwater Art Center is located in Sewickley and is available to assist with event preparations.
"{'event_name': 'Phipps Conservatory & Botanical Garden', 'location': 'Phipps Conservatory & Botanical Gardens', 'description': '14 indoor rooms & 3 outdoor gardens feature exotic plants & floral displays from around the world.\n412-622-6914'}",Phipps Conservatory & Botanical Garden features 14 indoor rooms and 3 outdoor gardens with exotic plants and floral displays from around the world.
"{'event_name': 'Pittsburgh Parrot Rescue', 'location': None, 'description': 'To work tables and seminars, make bird toys, fundraising and more.\n412-761-2268'}","Pittsburgh Parrot Rescue offers workshops, sells bird toys, and raises funds."
"{'event_name': 'The New Yinzer', 'location': None, 'description': 'Seeking original essays about literature, music, TV or film, & also essays generally about Pittsburgh. To see some examples, visit  & view the current issue. Email all pitches, submissions & inquiries to[email\xa0protected].'}","The New Yinzer is an open call for original essays on literature, music, TV, film, and general topics about Pittsburgh."
"{'event_name': 'YoungLives', 'location': None, 'description': 'Volunteer opportunities to serve teenage mothers and their children. Mentors, childcare volunteers, etc. younglivespittsburgh.younglife.org\n412-452-2344'}",Volunteer opportunities for serving teenage mothers and their children.
"{'event_name': 'Pittsburgh League of Young Voters', 'location': None, 'description': 'Help with outreach at concerts, clubs and fairs.\n412-728-2197'}","Volunteers needed for outreach at concerts, clubs, and fairs in Pittsburgh."
"{'event_name': 'Hunger Services Urban League of Pittsburgh', 'location': None, 'description': 'Office and administrative help needed.\n412-325-0746'}",Office and administrative help needed for Hunger Services Urban League of Pittsburgh.
"{'event_name': 'Pittsburgh Parks Conservancy', 'location': None, 'description': 'Docent-led tour of various parks. Historical, conditioning and nature hikes.\n412-682-7275'}","Docent-led tours of Pittsburgh parks, including historical, conditioning, and nature hikes."
"{'event_name': 'Eastern Area Adult Services', 'location': None, 'description': 'To help work the home-delivered meals program at the Turtle Creek & Swissvale Senior Centers.\n412-824-6880'}",The document provides contact information for Eastern Area Adult Services to assist with the home-delivered meals program at Turtle Creek & Swissvale Senior Centers.
"{'event_name': 'Girl Scouts of America', 'location': None, 'description': 'Seeking adult volunteers to assitst Girl Scout troops in all neighbors of Pittsburgh.\n412-689-6337'}",Girl Scouts of America is seeking adult volunteers to assist Girl Scout troops in Pittsburgh.
"{'event_name': 'UPMC Shadyside', 'location': None, 'description': 'To help visit hospitalized older patients. Training provided.\n412-623-1793'}",UPMC Shadyside offers training to help visit hospitalized older patients.
"{'event_name': 'Boulevard Gallery & Different Strokes Gallery', 'location': None, 'description': 'Searching for glass artists, fiber artists, potters, etc. to compliment the exhibits for 2015 & 2016. Booking for both galleries for 2017. Exhibits run from 1 to 2 months.\n412-721-0943'}","Boulevard Gallery & Different Strokes Gallery is seeking glass artists, fiber artists, and potters for their 2015 and 2016 exhibits, with bookings for 2017 and exhibits running from 1 to 2 months."
"{'event_name': 'The Poet Band Company', 'location': None, 'description': 'Seeking various types of poetry. Contact[email\xa0protected]'}",Poetry seeking event seeking various types of poetry.
"{'event_name': 'READ! 365', 'location': None, 'description': 'Program to read to children. Various venues and times.\n412-365-2034'}",A program to read to children at various venues and times.
"{'event_name': 'Pittsburgh Cares', 'location': 'Pittsburgh Cares', 'description': 'Various volunteering opportunities available throughout the Greater Pittsburgh Region for adults, families, seniors, youth, and businesses.\n412-471-2114'}",Pittsburgh Cares offers volunteering opportunities across the Greater Pittsburgh Region.
"{'event_name': 'GLENDA', 'location': None, 'description': 'Seeking volunteers to promote diversity in the Pittsburgh region through community service.\n412-422-1303'}",Volunteers needed to promote diversity in Pittsburgh through community service.
"{'event_name': 'Steel on Ice', 'location': None, 'description': 'African-American ski club with year-round activities.\n412-339-0585'}",African-American ski club with year-round activities.
"{'event_name': 'Global Links', 'location': None, 'description': 'Groups & organizations to pack & sort medical supplies for shipment to developing countries.\n412-361-3424 x205'}",Global Links is a group or organization that packs and sorts medical supplies for shipment to developing countries.
"{'event_name': 'Ark of Learning', 'location': None, 'description': 'Tutoring students in grades K-9. New Kensington Salvation Army.\n724-335-7221'}",Ark of Learning is a tutoring program for K-9 students at New Kensington Salvation Army.
"{'event_name': 'The Pittsburgh Tote Bag Project', 'location': None, 'description': 'Seeking volunteers to staff tables at events throughout the spring & summer. Orientation held at the Squirrel Hill & Northside Crazy Mocha twice a month. \n412-228-0216'}",Volunteers needed for tote bag project at events in Pittsburgh.
"{'event_name': 'Dress For Success Pittsburgh', 'location': None, 'description': 'Organization prepares economically disadvantaged women succeed in the workforce. Looking for image consultants, administrative workers, donation pick-up coordinators & more. Also accepting donations.\n412-201-4204'}","Dress For Success Pittsburgh is an organization seeking image consultants, administrative workers, and donation pick-up coordinators for economically disadvantaged women to succeed in the workforce."
"{'event_name': 'Youth Engaged in Service', 'location': None, 'description': 'One-time volunteer projects for youth 12-21. Pittsburgh Cares, Downtown.\n412-471-2114'}","One-time volunteer projects for youth aged 12-21 in Pittsburgh, organized by Downtown."
"{'event_name': 'Treasure House Fashions', 'location': 'Treasure House Fashions', 'description': 'Treasure House Fashions is a non profit boutique- style woman’s clothing shop that works w/ area nonprofits helping women in transition or crisis. We need volunteers to help us in our McKnight Road store. Tasks would include helping clients w/ clothing selections as needed, working the cash register, steaming & stocking clothing, keeping the clothing racks neat & the store in order. 412-979-1534 for more info.\n412-979-1534'}","A non-profit boutique-style women's clothing shop seeking volunteers for various tasks including clothing selection assistance, cash register work, and store organization."
"{'event_name': 'Ten Thousand Villages', 'location': None, 'description': 'To staff nonprofit store in Squirrel Hill providing income to Third World artisans.\n412-421-2160'}",A nonprofit store in Squirrel Hill providing income to Third World artisans.
"{'event_name': 'Wheels for Wishes', 'location': None, 'description': 'Car Donation Program Benefiting the Make-A-Wish Foundation. Free towing. \n1-855-675-WISH'}","Car Donation Program for Make-A-Wish Foundation, free towing, 1-855-675-WISH."
"{'event_name': 'Pittsburgh Zoo & PPG Aquarium', 'location': 'Pittsburgh Zoo & PPG Aquarium', 'description': 'Home to 4,000 animals, including many endangered species.\n412-665-3639'}","Summary: The Pittsburgh Zoo & PPG Aquarium is a zoo and aquarium located in Pittsburgh, Pennsylvania, home to 4,000 animals including endangered species."
"{'event_name': 'Planned Parenthood of Western Pennsylvania', 'location': None, 'description': 'For a wide variety of projects.\n412-434-8967 x119'}",Planned Parenthood of Western Pennsylvania offers various projects at 412-434-8967 x119.
"{'event_name': 'Eclectic Art & Objects Gallery', 'location': 'Eclectic Art & Objects Gallery', 'description': '19th century American & European paintings combined w/ contemporary artists & their artwork.\n412-734-2099'}",Eclectic Art & Objects Gallery offers 19th century American and European paintings alongside contemporary artists' works.
"{'event_name': 'New Hazlett Theater', 'location': 'New Hazlett Theater', 'description': 'Seeking volunteer ushers. Training & orientation is provided.\n412-320-4610 x 15'}",New Hazlett Theater is seeking volunteer ushers for training and orientation.
"{'event_name': 'Sierra Club', 'location': None, 'description': 'To educate voters on environmental issues.\n412-802-6161'}",Sierra Club is an organization that educates voters on environmental issues.
"{'event_name': 'North Hills Community Outreach', 'location': None, 'description': 'Teach computer literacy classes, coordinate food drives, take seniors to doctor appointments, more.\n412-487-6316'}","North Hills Community Outreach offers computer literacy classes, food drives, and visits seniors to doctor appointments."
"{'event_name': 'World Naked Bike Ride Philadelphia', 'location': 'Philadelphia Street Playhouse', 'description': 'Dear friends,\nWe are so excited to announce the date for this years ride!\nCelebrating bicycle power and the beauty of people World Naked Bike Ride (WNBR) is an international clothing-optional people powered event that highlights the vulnerability of cyclists everywhere, decries society’s dependence on pollution-based transport and promotes positive body image. It’s also just a lot of fun!\nThe event is bare-as-you-dare; anything from body paint to underwear to fanciful costumes are encouraged. Due to legal restrictions full frontal nudity full frontal nudity is at your own risk, but many do go all out.\n847-901-3710', 'price': 'free'}",World Naked Bike Ride Philadelphia is an international clothing-optional event promoting bicycle-powered transportation and positive body image.
"{'event_name': 'Spanish Conversation Group', 'location': 'Target', 'description': 'Friendly, informal. Meet at Starbucks.\n412-362-6108'}","Spanish Conversation Group: Friendly, informal meet at Starbucks."
"{'event_name': 'Happy Hour', 'location': ""Rick's Cabaret & Sports Bar"", 'description': 'Join us at Ricks for Discounted food and drinks.\n412-281-7703'}",Summary: A discount event at Rick's Cabaret & Sports Bar.
"{'event_name': 'The Helltown Tap Room Saturday Afternoon Jazz Jam w/ Tony Campbell', 'location': 'Helltown Tap Room', 'description': 'Socially distancing jazz jam session. Musicians and Vocalists are welcome !!!!!!!!!!!!!!! Singers must bring their own microphone !!! Drummers must bring their own sticks ! Horn players must be 6 feet apart !!!!!! Wipes are on hand. Tony Campbell -Sax Jevon Rushton - Drums Eli Naragon - Bass Antonio Croes - Keys\n412-315-7059'}","A socially distanced jazz jam session at Helltown Tap Room featuring Tony Campbell, Jevon Rushton, Eli Naragon, and Antonio Croes."
"{'event_name': 'Higher Ground', 'location': 'Christ Lutheran Church', 'description': 'Looking for a different worship experience?\nHigher Ground offers interactive worship with open prayer, singing, music by Soul Spirit, and preaching by Pastor Scott on the spiritual subjects that affect us today. Come and be a part of the joyous, upbeat and energizing experience that abides in Higher Ground each week at CLC Millvale. Childcare is provided.\n412-821-4300'}","Higher Ground is an interactive worship experience offering open prayer, singing, music, and preaching at Christ Lutheran Church."
