text,contextual_chunk
"{'event_name': 'Union', 'date': 'Oct 23, 2024', 'description': 'Arts + Culture, Entertainment, Film & Movies Union  Up against one of the most powerful companies on the planet, a group of Amazon workers embark on an unprecedented campaign to unionize their warehouse in Staten Island, New York. READ MORE', 'time': '8:00 pm - 10:00 pm'}","A group of Amazon workers in Staten Island, New York, plan to unionize their warehouse."
"{'event_name': 'Music of Led Zeppelin', 'date': 'Oct 24, 2024', 'description': 'Arts + Culture, Entertainment, Music Music of Led Zeppelin  Bridging the gulf between rock n’ roll and classical music, the Pittsburgh Symphony Orchestra performs The Music of Led Zeppelin. READ MORE', 'time': '7:30 pm - 10:30 pm'}","Pittsburgh Symphony Orchestra performs ""The Music of Led Zeppelin"" at the Pittsburgh Symphony Hall."
"{'event_name': 'Nadcap', 'description': 'Convention Nadcap  Nadcap is the premier program for accrediting critical processes in the aerospace and defense industries, Nadcap focuses on standardizing approaches to quality assurance and promoting continuous improvement.  This program is essential for suppliers seeking to demonstrate their commitment to excellence. READ MORE', 'date': 'Oct 21, 2024 - Oct 24, 2024'}","Nadcap is a program for accrediting critical processes in aerospace and defense industries, focusing on quality assurance and continuous improvement."
"{'date': 'Oct 21, 2024 - Oct 24, 2024', 'description': 'Nadcap is the premier program for accrediting critical processes in the aerospace and defense industries, Nadcap focuses on standardizing approaches to quality assurance and promoting continuous improvement. This program is essential for suppliers seeking to demonstrate their commitment to excellence.', 'category': 'Convention', 'venue': 'Omni William Penn Hotel 530 William Penn Pl Pittsburgh, PA 15219', 'more_details': 'Nadcap is the premier program for accrediting critical processes in the aerospace and defense industries, Nadcap focuses on standardizing approaches to quality assurance and promoting continuous improvement.Â This program is essential for suppliers seeking to demonstrate their commitment to excellence. The Napcap staff & attendees of the conference will be on their own for all meals (breakfast, lunch, and dinner) during their visit to Pittsburgh.', 'event_name': 'Nadcap'}","Nadcap is a program for accrediting critical processes in aerospace and defense industries, focusing on quality assurance and continuous improvement."
"{'event_name': 'Pour Me Another - St. George Spirits Dinner', 'date': 'Oct 24, 2024', 'description': 'Community Pour Me Another - St. George Spirits Dinner  Get ready to raise your glass and enjoy a night of great food and drinks at Pour Me Another - October 2024! READ MORE', 'time': '6:30 pm - 8:30 pm'}","St. George Spirits Dinner at Pour Me Another on October 24, 2024, from 6:30 pm to 8:30 pm."
"{'event_name': 'Ofrenda Happy Hour', 'date': 'Oct 24, 2024', 'description': 'Arts + Culture, Community, Family Ofrenda Happy Hour  Kick off the\xa0Día de los Muertos festivities with Pittsburgh Metropolitan Area Hispanic Chamber of Commerce at the Ofrenda Happy Hour! READ MORE', 'time': '6:00 pm - 9:00 pm'}",Día de los Muertos celebration kick-off event at the Ofrenda Happy Hour.
"{'event_name': 'Pitt Panthers vs. Syracuse Orange', 'date': 'Oct 24, 2024', 'description': 'Entertainment, Sports + Recreation Pitt Panthers vs. Syracuse Orange  The Pitt Panthers take on Syracuse Orange in 2024 NCAA Football action at Acrisure Stadium. READ MORE', 'time': '7:30 pm - 10:30 pm'}","Pitt Panthers vs. Syracuse Orange football game on October 24, 2024, at Acrisure Stadium."
"{'event_name': 'Disenchanted!', 'date': 'Oct 24, 2024', 'description': 'Arts + Culture, Entertainment Disenchanted!  Poisoned apples. Glass slippers. Who needs ’em?! Not Snow White and her posse of disenchanted princesses in the hilarious hit musical that’s anything but Grimm. READ MORE', 'time': '7:30 pm - 11:00 pm'}",A hilarious musical about disenchanted princesses.
"{'event_name': 'Nosferatu: A Symphony of Horror (1922) with live score by Tom Roberts', 'date': 'Oct 24, 2024', 'description': 'Arts + Culture, Entertainment, Film & Movies Nosferatu: A Symphony of Horror (1922) with live score by Tom Roberts  A genre-defining film for the ages, Nosferatu returns to the Harris Theater with Tom Roberts performing his own original score live. READ MORE', 'time': '8:00 pm - 10:00 pm'}",Nosferatu: A Symphony of Horror returns to the Harris Theater with Tom Roberts performing his original score live.
"{'event_name': 'Lit Friday: Mecca Jamilah Sullivan', 'date': 'Oct 25, 2024', 'description': 'Arts + Culture, Free event, Online & Virtual Events Lit Friday: Mecca Jamilah Sullivan  Mecca Jamilah Sullivan joins LIT Friday to discuss WE ARE A HAUNTING. READ MORE', 'time': '6:00 pm - 7:00 pm'}","A free online event discussing ""WE ARE A HAUNTING"" by Mecca Jamilah Sullivan on Lit Friday at 6:00 pm."
"{'event_name': 'Coffee + Connect', 'date': 'Oct 25, 2024', 'description': 'Community Coffee + Connect  Join us to enjoy some coffee and snacks and meet a representative from a local community organization to learn more about their services. READ MORE', 'time': '10:00 am - 11:00 am'}","Community Coffee + Connect event on October 25, 2024, featuring coffee and snacks, with a representative from a local community organization to discuss services."
"{'event_name': 'Moonlight Dance Cruise & Tour', 'date': 'Oct 25, 2024', 'description': 'Nightlife, Tours Moonlight Dance Cruise & Tour  It’s time to party out on the water every Friday night this summer! DJ ROK is back on the boat with a mix of the best of today’s urban hits, hip-hop, rap, R&B, and old school jams. And enjoy a free Midnight Buffet!   Must be 21 years of age. Valid photo ID required. READ MORE', 'time': '10:30 pm - 1:30 am'}","A Moonlight Dance Cruise & Tour event on Friday nights in October 2024, featuring DJ ROK playing urban hits and hip-hop, with a free midnight buffet."
"{'event_name': 'Peter Pan', 'date': 'Oct 25, 2024', 'description': 'Arts + Culture, Entertainment Peter Pan  Escape to Neverland for a daring adventure with Wendy, John, Michael, Tinkerbell and Peter in the ever-playful Peter Pan. READ MORE', 'time': '7:30 pm - 10:30 pm'}","Peter Pan event at 7:30 pm - 10:30 pm on October 25, 2024, featuring a play about Wendy, John, Michael, Tinkerbell, and Peter in Neverland."
"{'event_name': 'Night Market', 'date': 'Oct 25 - Oct 26, 2024', 'description': 'Outdoor, Shopping Night Market  Night Markets bring an awesome outdoor pop-up shopping market and festival to Downtown, featuring Pittsburgh’s most creative independent vendors. Clothing, furniture, candles, food, drinks, and more are exhibited in this weekly series. READ MORE', 'time': '4:00 pm - 9:00 pm'}","Outdoor, Shopping Night Market from Oct 25-26, featuring Pittsburgh's creative vendors."
"{'event_name': 'GALLERY CRAWL', 'date': 'Oct 25, 2024', 'description': 'Entertainment GALLERY CRAWL  Get ready for a night of non-stop laughter at Arcade Comedy Theater during the Pittsburgh Cultural Trust Gallery Crawl on Friday, July 26th! We’re serving up FREE improv comedy shows every half hour from 6-10 PM. Beat the heat with some cool laughs in our A/C, and if you love it (which you will!), snag a discount on our 7 & 9 PM shows to keep the fun going. See you there for a comedy-packed evening! READ MORE', 'time': '6:00 pm - 8:00 pm'}","Pittsburgh Cultural Trust Gallery Crawl featuring free improv comedy shows from 6-10 PM on October 25, 2024."
"{'event_name': 'Select Start', 'date': 'Oct 25, 2024', 'description': 'Entertainment Select Start  Cultural District creative, Mr. Arcade, was found dead in the theater last week. To help figure out what calamity occurred, spiritual medium improv team, Select Start, will be called in to contact his ghost live to solve this recent murder. However… Select Start does stand to gain a lot from the death of Mr. Arcade. Perhaps… foul play has occurred? Come on down to find out and help us to solve this Murder Mystery! It will be an improv show to die for. READ MORE', 'time': '9:00 pm - 11:00 pm'}",A spiritual medium improv team will investigate the death of a cultural district creative to solve a murder mystery.
"{'event_name': 'Halloween Boogie Bash', 'date': 'Oct 25, 2024', 'description': ""Holidays, Nightlife Halloween Boogie Bash  Show off your spooky dance moves at our Halloween Boogie Bash! Dance the night away to thrilling beats and show off your costume for a chance to win wicked prizes. Enjoy themed drinks and delectable hors d'oeuvres while you mix and mingle with your ghoulfriends. READ MORE"", 'time': '6:30 pm - 9:30 pm'}","Halloween Boogie Bash is an event where attendees can dance, dress up, and win prizes while enjoying themed drinks and food."
"{'event_name': 'Juvenile Arthritis Family Fun Day', 'date': 'Oct 26, 2024', 'description': 'Community, Family, Workshops & Classes Juvenile Arthritis Family Fun Day  READ MORE', 'time': '10:00 am - 12:00 pm'}","Juvenile Arthritis Family Fun Day is an event scheduled for October 26, 2024, from 10:00 am to 12:00 pm, focusing on community, family, workshops, and classes related to juvenile arthritis."
"{'event_name': 'SkyWatch', 'date': 'Oct 26, 2024', 'description': 'Nightlife, Workshops & Classes SkyWatch  Guests are invited to reconnect with the night sky through a featured planetarium performance and, weather-permitting, live views of night sky objects in stunning telescopic detail. READ MORE', 'time': '9:00 pm - 11:00 pm'}",SkyWatch event invites guests to view the night sky through a planetarium performance and live telescopic views.
"{'event_name': 'SkyWatch', 'date': 'Oct 26, 2024', 'description': 'Community, Nightlife SkyWatch  Stargaze a Saturday night away. Reconnect with the night sky through a featured planetarium performance and, weather-permitting, live views of night sky objects in telescopic detail. READ MORE', 'time': '9:00 pm - 11:00 pm'}","Community, Nightlife SkyWatch: Stargaze a Saturday night featuring planetarium performance and live sky views."
"{'event_name': '2024 ATA Fall Nationals Tournament', 'description': 'Convention, Sports + Recreation 2024 ATA Fall Nationals Tournament  Athletes will compete through the ATA Fall National 2024. READ MORE', 'date': 'Oct 25, 2024 - Oct 26, 2024'}","2024 ATA Fall Nationals Tournament: Oct 25-26, 2024"
"{'date': 'Oct 25, 2024 - Oct 26, 2024', 'description': 'Athletes will compete through the ATA Fall National 2024.', 'category': 'Convention,, Sports + Recreation', 'venue': 'David L. Lawrence Convention Center 1000 Fort Dusquene Boulevard Pittsburgh, PA 15222', 'more_details': '', 'event_name': '2024 ATA Fall Nationals Tournament'}","2024 ATA Fall Nationals Tournament takes place at the David L. Lawrence Convention Center in Pittsburgh, Pennsylvania from October 25 to 26."
"{'event_name': 'Dandy Andy: Warhol’s Queer History', 'date': 'Oct 26, 2024', 'description': 'Arts + Culture Dandy Andy: Warhol’s Queer History  Join artist educators for Dandy Andy, a monthly tour that focuses on Warhol’s queer history. READ MORE', 'time': '3:00 pm - 6:00 pm'}",Monthly tour focusing on Warhol's queer history led by artist educators.
"{'event_name': 'Bikes & Brews Tour', 'date': 'Oct 26, 2024', 'description': 'Outdoor, Tours Bikes & Brews Tour  Join us on a ride around the historic districts of Deutschtown, Millvale, and Lawrenceville as we visit 4 of our favorite local breweries and learn about the past, present, and future of beer making in Pittsburgh, with an emphasis on how beer figures in the diverse communities of the Steel City. READ MORE', 'time': '2:00 pm - 5:30 pm'}","Bikes & Brews Tour is an outdoor event that takes place on October 26, 2024, featuring a ride around historic districts of Pittsburgh, visiting 4 local breweries to learn about beer history and its impact on the city's diverse communities."
"{'event_name': 'Black & Gold Tour', 'date': 'Oct 26, 2024', 'description': 'Tours Black & Gold Tour  Hop aboard and see the Steel City like never before on this one-of-a-kind, tailgate style tour… only in THE BURGH! READ MORE', 'time': '12:00 pm - 1:30 pm'}","Black & Gold Tour is a tailgate-style tour of Pittsburgh, scheduled for October 26, 2024, from 12:00 pm to 1:30 pm."
"{'event_name': 'Harry Potter and the Order of the Phoenix™ in Concert', 'date': 'Oct 26, 2024', 'description': 'Entertainment, Film & Movies, Music Harry Potter and the Order of the Phoenix™ in Concert  Experience your favorite movies transformed with the music of a live symphony orchestra in the Harry Potter™ Film Concert Series.? READ MORE', 'time': '7:00 pm - 11:00 pm'}",Harry Potter and the Order of the Phoenix™ in Concert is an entertainment event featuring live symphony orchestra music from the Harry Potter film series.
"{'event_name': 'Peter Pan', 'date': 'Oct 26, 2024', 'description': 'Arts + Culture, Entertainment Peter Pan  Escape to Neverland for a daring adventure with Wendy, John, Michael, Tinkerbell and Peter in the ever-playful Peter Pan. Showtimes are at 2 pm and 7:30 pm! READ MORE'}","Peter Pan is an entertainment event featuring a play about Peter Pan and his friends, with showtimes at 2 pm and 7:30 pm."
"{'event_name': 'Peter Pan', 'date': 'Oct 26, 2024', 'description': 'Escape to Neverland for a daring adventure with Wendy, John, Michael, Tinkerbell and Peter in the ever-playful Peter Pan. Showtimes are at 2 pm and 7:30 pm!'}","Peter Pan is an adventure show featuring characters from the story, including Wendy, John, Michael, Tinkerbell, and Peter, with showtimes at 2 pm and 7:30 pm."
"{'date': 'Oct 27, 2024 | 2:00 pm - 5:00 pm', 'description': 'Escape to Neverland for a daring adventure with Wendy, John, Michael, Tinkerbell and Peter in the ever-playful Peter Pan.', 'category': 'Arts + Culture,, Entertainment', 'venue': 'Benedum Center 7th St and Penn Ave Pittsburgh, PA 15222', 'more_details': 'Escape to Neverland for a daring adventure with Wendy, John, Michael, Tinkerbell and Peter in the ever-playful Peter Pan. This new interpretation of the classic tale is told through the eyes of a child, and includes spectacular flying, swashbuckling sword fights, giant puppets, costumes inspired by punk fashion and, of course, a little pixie dust! A Pittsburgh premiere, this magical ballet is sure to mesmerize audiences of all ages. Choreography: Trey McIntyre | Music: Edward Elgar, arranged by Niel DePonte Flying Effects provided by ZFX', 'event_name': 'Peter Pan'}","Peter Pan, a new ballet adaptation featuring Wendy, John, Michael, Tinkerbell, and Peter, tells the classic tale through a child's perspective with flying, sword fights, giant puppets, and pixie dust, directed by Trey McIntyre and choreographed by Niel DePonte, performed by ZFX flying effects, and set to Edward Elgar's music, with a Pittsburgh premiere."
"{'date': 'Oct 25, 2024 | 7:30 pm - 10:30 pm', 'description': 'Escape to Neverland for a daring adventure with Wendy, John, Michael, Tinkerbell and Peter in the ever-playful Peter Pan.', 'category': 'Arts + Culture,, Entertainment', 'venue': 'Benedum Center 7th St and Penn Ave Pittsburgh, PA 15222', 'more_details': 'Escape to Neverland for a daring adventure with Wendy, John, Michael, Tinkerbell and Peter in the ever-playfulÂ Peter Pan . This new interpretation of the classic tale is told through the eyes of a child, and includes spectacular flying, swashbuckling sword fights, giant puppets, costumes inspired by punk fashion and, of course, a little pixie dust! A Pittsburgh premiere, this magical ballet is sure to mesmerize audiences of all ages. Choreography: Trey McIntyre | Music: Edward Elgar, arranged by Niel DePonte Flying Effects provided by ZFX', 'event_name': 'Peter Pan'}","Peter Pan, a new ballet adaptation featuring Wendy, John, Michael, Tinkerbell, and Peter, tells the classic tale through a child's perspective with flying, sword fights, giant puppets, and pixie dust, directed by Trey McIntyre and choreographed by Niel DePonte, performed by ZFX flying effects, and set to Edward Elgar's music, premiering at the Benedum Center in Pittsburgh."
"{'event_name': 'Taekwondo 2024 Fall Nationals', 'description': 'Convention, Sports + Recreation Taekwondo 2024 Fall Nationals  The American Taekwondo Association (ATA) is excited be in Pittsburgh for the 2024 Fall Nationals, Oct. 23-26 at the David L. Lawrence Convention Center. This is the third consecutive year ATA has held this event in Pittsburgh! READ MORE', 'date': 'Oct 23, 2024 - Oct 26, 2024'}",The American Taekwondo Association will hold the 2024 Fall Nationals in Pittsburgh from October 23 to 26.
"{'date': 'Oct 23, 2024 - Oct 26, 2024', 'description': 'The American Taekwondo Association (ATA) is excited be in Pittsburgh for the 2024 Fall Nationals, Oct. 23-26 at the David L. Lawrence Convention Center. This is the third consecutive year ATA has held this event in Pittsburgh!', 'category': 'Convention,, Sports + Recreation', 'venue': 'David L. Lawrence Convention Center & The Westin Pittsburgh', 'more_details': 'The American Taekwondo Association (ATA) is excited be in Pittsburgh for the 2024 Fall Nationals, Oct. 23-26 at the David L. Lawrence Convention Center. This is the third consecutive year ATA has held this event in Pittsburgh! ATA aims to develop martial arts skills, self-defense, physical fitness, and character growth in students through a fun and educational environment. All ages, ranks and divisions are welcomed. For a detailed event schedule, please clickÂ here . Attendees will be traveling in groups to hotels and dining establishments. Restaurants Downtown should be prepared to see an increase in foot traffic as competition concludes on Thursday through Saturday. ATA aims to develop martial arts skills, self-defense, physical fitness, and character growth in students through a fun and educational environment. All ages, ranks and divisions are welcomed. For a detailed event schedule, please clickÂ here . Attendees will be traveling in groups to hotels and dining establishments. Restaurants Downtown should be prepared to see an increase in foot traffic as competition concludes on Thursday through Saturday. For a detailed event schedule, please clickÂ here . Attendees will be traveling in groups to hotels and dining establishments. Restaurants Downtown should be prepared to see an increase in foot traffic as competition concludes on Thursday through Saturday. Attendees will be traveling in groups to hotels and dining establishments. Restaurants Downtown should be prepared to see an increase in foot traffic as competition concludes on Thursday through Saturday.', 'event_name': 'Taekwondo 2024 Fall Nationals'}","The American Taekwondo Association (ATA) is hosting the 2024 Fall Nationals in Pittsburgh, featuring martial arts, self-defense, physical fitness, and character development."
"{'event_name': 'Pittsburgh Riverhounds SC vs. El Paso Locomotive', 'date': 'Oct 26, 2024', 'description': 'Sports + Recreation Pittsburgh Riverhounds SC vs. El Paso Locomotive  Come cheer on the Pittsburgh Riverhounds as they take on El Paso Locomotive! READ MORE', 'time': '7:00 pm - 10:00 pm'}","Sports game between Pittsburgh Riverhounds SC and El Paso Locomotive scheduled for October 26, 2024, starting at 7:00 pm."
"{'event_name': 'Beta Stage', 'date': 'Oct 26, 2024', 'description': 'Entertainment Beta Stage  Join us monthly as we showcase new and experimental acts, returning teams, and new ideas by familiar favorites! See the Arcade shows of tomorrow TODAY* READ MORE', 'time': '6:00 pm - 8:00 pm'}","Entertainment Beta Stage event showcases new acts, returning teams, and ideas from familiar favorites."
"{'event_name': 'Knights of the Arcade: Epic D&D Adventure', 'date': 'Oct 26, 2024', 'description': 'Entertainment Knights of the Arcade: Epic D&D Adventure  Join Knights of the Arcade on Saturday, August 31, at 9 PM for another hilarious D&D comedy adventure! One of Pittsburgh’s longest running and best-selling comedy shows! A recurring cast of characters are joined by special guests and led by their maniacal dungeon master. Where they’re going, who they fight, and if they ultimately succeed is decided upon live dice that are rolled and projected on the theater wall. READ MORE', 'time': '9:00 pm - 11:00 pm'}","Entertainment event featuring a D&D comedy show with recurring cast and special guests, live dice rolling, and projections on the theater wall."
"{'event_name': 'Mike Super - Magic & Illusion', 'date': 'Oct 26, 2024', 'description': 'Entertainment Mike Super - Magic & Illusion  Experience the Magic & Illusion of Mike Super LIVE on Stage! This is the perfect evening for your entire family! READ MORE', 'time': '7:00 pm - 8:30 pm'}","Entertainment event featuring Mike Super's magic and illusion show from Oct 26, 2024, at 7:00 pm to 8:30 pm."
"{'event_name': 'Halloween Fun Cruise', 'date': 'Oct 26, 2024', 'description': 'Holidays, Tours Halloween Fun Cruise  Boards: 10:00 a.m. and 1:00 p.m.; and Sails: 10:30 a.m - 12:30 p.m. and 1:30 - 3:30 p.m. - Come aboard a Pittsburgh sightseeing tour for a kids’ costume party with frightfully friendly characters, tons of fun prizes and more! Music, dancing and treat bags for all the kids. We can’t wait to see you all on board our riverboat in your favorite Halloween costume! READ MORE'}","Halloween Fun Cruise is a Pittsburgh sightseeing tour with a kids' costume party, featuring frightfully friendly characters, music, dancing, and treat bags."
"{'event_name': 'Halloween Fun Cruise', 'date': 'Oct 26, 2024', 'description': 'Boards: 10:00 a.m. and 1:00 p.m.; and Sails: 10:30 a.m - 12:30 p.m. and 1:30 - 3:30 p.m. - Come aboard a Pittsburgh sightseeing tour for a kids’ costume party with frightfully friendly characters, tons of fun prizes and more! Music, dancing and treat bags for all the kids. We can’t wait to see you all on board our riverboat in your favorite Halloween costume!'}","A Halloween-themed cruise with kids' costume party, featuring frightfully friendly characters, music, dancing, and treat bags."
"{'event_name': 'Boo N Brew Dance Cruise & Tour', 'date': 'Oct 26, 2024', 'description': 'Nightlife, Tours Boo N Brew Dance Cruise & Tour  Join us on the dock starting at 6:00 pm for free psychic and tarot card readings, prizes and mingle with your favorite BOB FM on air personalities. At 8 pm, the party hits the water with the band “Random Play” playing all your favorites hits – 96.9 BOB FM style! Don’t forget to wear your Halloween costumes for your chance to win great prizes including concert and event tickets, and a fantastic grand prize to be announced! READ MORE', 'time': '6:00 pm - 10:30 pm'}","A nighttime cruise with free psychic readings, prizes, and a chance to win concert tickets and grand prizes."
"{'event_name': 'Fitness Open House', 'date': 'Oct 26, 2024', 'description': 'Community, Sports + Recreation Fitness Open House  Join River Club for their 2nd Annual Fitness Open House! READ MORE', 'time': '10:00 am - 1:00 pm'}","Fitness Open House at River Club from 10:00 am to 1:00 pm on October 26, 2024."
"{'event_name': 'Lucky Draw', 'date': 'Oct 27, 2024', 'description': 'Entertainment Lucky Draw  Arcade Comedy Theater presents “Lucky Draw” an improv comedy show where half of the cast is drawn at random! READ MORE', 'time': '7:30 pm - 8:30 pm'}","Entertainment Lucky Draw, an improv comedy show featuring a randomly selected half of the cast, taking place at 7:30 pm - 8:30 pm."
"{'event_name': 'Faces of Resilience Workshops', 'description': 'Community, Workshops & Classes Faces of Resilience Workshops  Are you a survivor of gun violence, or do you know someone who is? Join us for Faces of Resilience, a transformative two-day workshop at the August Wilson African American Cultural Center, where you’ll create powerful masks to express your emotions, celebrate your loved ones, and honor your triumphs. READ MORE', 'date': 'Oct 26, 2024 - Oct 27, 2024'}","Two-day workshop at the August Wilson African American Cultural Center to create masks to express emotions, celebrate loved ones, and honor triumphs."
