section,text
Facilities -> Tertiary hospitals -> UPMC Altoona,"UPMC Altoona, located in Altoona, Pennsylvania, is a 361-bed, non-profit, private community hospital system that contains more than 20 affiliated health care companies and functions as the regional referral center and tertiary hub of UPMC in west central Pennsylvania."
Facilities -> Tertiary hospitals -> UPMC Hamot -> Magee-Womens Hospital - UPMC Hamot Campus,"UPMC Hamot Women's Hospital is a five-story, 165,000 square-foot, 93-bed stand-alone hospital that opened in 2011. The hospital houses obstetrics, neonatology, and gynecology specialities of UPMC Hamot and includes a Level III neonatal intensive care unit. As of October 2013, it also houses the Pediatrics wing of UPMC Hamot."
Facilities -> Tertiary hospitals -> UPMC Hamot -> UPMC Kane,"UPMC Kane, formerly known as Kane Community Hospital, is a 31-bed acute care hospital located in Kane, Pennsylvania, that became an affiliate of UPMC Hamot in November, 2009. UPMC Kane was fully integrated into the UPMC network on April 1, 2017, and functions as a direct subsidiary of UPMC Hamot."
Facilities -> Tertiary hospitals -> UPMC Passavant,"UPMC Passavant is UPMC's tertiary care hospital of Pittsburgh's northern suburbs that consist of two campuses, one in McCandless and another in Cranberry Township with a combined 423 beds. Founded by Lutherans in 1849, Passavant was the first Protestant hospital built in the United States. In 1964, Passavant moved from the City of Pittsburgh to its location in McCandless to serve the communities of northern Allegheny and southern Butler counties. Passavant merged with UPMC in 1997 and in 2002, as part of UPMC's acquisition of St. Francis Medical Center for the conversion of its flagship facility into the new Children's Hospital of Pittsburgh, UPMC converted St. Francis' hospital in Cranberry into a satellite campus of UPMC Passavant. In 2010, a seven-story 188,000 square foot patient pavilion was opened on the McCandless campus bringing total beds there to 399."
Facilities -> Tertiary hospitals -> UPMC Harrisburg,"UPMC Harrisburg is a 409-bed urban, teaching hospital in Harrisburg, Pennsylvania, serving as the primary referral hospital for the UPMC Central PA system which comprises seven hospitals and additional clinics serving south central and southeastern Pennsylvania."
Facilities -> Tertiary hospitals -> UPMC Susquehanna Williamsport,"UPMC Susquehanna Williamsport is a 224-bed tertiary hospital in Williamsport, Pennsylvania, serving as the primary referral hospital of the six hospital UPMC Susquehanna system serving north central Pennsylvania."
Facilities -> Acute care/community hospitals,"UPMC operates the following acute care community hospitals dedicated to specific missions within their particular communities.

UPMC Bedford, located in Everett, Pennsylvania.
UPMC Chautauqua, located in  Jamestown, New York, is a 317-bed hospital that was originally charted in 1885. It is the only domestic hospital located outside of Pennsylvania to become part of the UPMC system.
UPMC East, a $250 million full-service, 155-bed hospital that opened in Monroeville, Pennsylvania, in July, 2012.
UPMC Horizon, which consists of the Greenville and Shenango Valley campuses.
UPMC Jameson, located in New Castle, Pennsylvania.
UPMC McKeesport, located in McKeesport, Pennsylvania.
UPMC Northwest, located in Seneca, Pennsylvania.
UPMC St. Margaret, a 248-bed acute care and teaching hospital in the northeast corner of Pittsburgh, near Aspinwall, PA, serving the residents of northeastern Allegheny County and the Alle-Kiski Valley.
UPMC Central Pa which comprises seven hospitals, including its tertiary flagship UPMC Harrisburg, serves South Central Pennsylvania, operates the following seven community hospitals:
UPMC Carlisle located in Carlisle, Pennsylvania
UPMC Hanover located in Hanover, Pennsylvania
UPMC Lititz located in Lititz, Pennsylvania
UPMC Memorial located in York, Pennsylvania
UPMC Community Osteopathic located in Harrisburg, Pennsylvania
UPMC West Shore located in Mechanicsburg, Pennsylvania
UPMC Somerset, a 111-bed, general acute care community hospital located in Somerset, Pennsylvania
UPMC Susquehanna which comprises five hospitals, including its tertiary flagship UPMC Williamsport, operates the additional four community hospitals in north central Pennsylvania and one outpatient emergency center:
UPMC Cole located in Coudersport, Pennsylvania
UPMC Lock Haven (outpatient emergency center) located in Lock Haven, Pennsylvania
UPMC Muncy located in Muncy, Pennsylvania
UPMC Wellsboro located in Wellsboro, Pennsylvania
UPMC Williamsport Divine Providence Campus located in Williamsport, Pennsylvania
UPMC Washington, a 244-bed hospital located in Washington, Pennsylvania
UPMC Greene, a 23-bed hospital of the former Washington Health System located in Waynesburg, Pennsylvania
UPMC Western Maryland, a 200-bed hospital located in Cumberland, Maryland"
Facilities -> International hospitals and facilities -> ISMETT,"The Mediterranean Institute for Transplantation and Advanced Specialized Therapies (Istituto Mediterraneo per i Trapianti e Terapie ad Alta Specializzazione, or ISMETT) is located in Palermo, Italy, and serves the region of Sicily and the Mediterranean as a hospital designed exclusively for transplants and treatment of end-stage organ failure. ISMETT is a joint public-private partnership between the Region of Sicily, through Civico and Cervello hospitals in Palermo, and UPMC, which manages and operates the facility. It is also a center for research in regenerative medicine and various international collaborations including the University of Pittsburgh's and UPMC's McGowan Institute for Regenerative Medicine."
Facilities -> International hospitals and facilities -> UPMC Kildare,"UPMC Kildare Hospital is a 39-bed private hospital located in County Kildare, Ireland (founded in 1985 as Clane General Hospital). UPMC acquired the hospital in November 2019 in partnership with the Institute of Eye Surgery."
Facilities -> International hospitals and facilities -> UPMC Whitfield,"UPMC Whitfield is an 80-bed private hospital located in Waterford, Ireland.  UPMC, which had operated a cancer center at the hospital since 2006, acquired the hospital on May 24, 2018."
Facilities -> International hospitals and facilities -> UPMC Salvator Mundi,"UPMC Salvator Mundi International Hospital 75-bed private hospital in Rome, Italy, that is jointly owned by UPMC and Rome International Hospital Management Srl. UPMC owns a 50% stake in the hospital and leads its medical operations including having responsibility for selecting its medical director and chief operating officer."
Facilities -> Former hospitals,"Former UPMC hospitals include UPMC Sunbury in Sunbury, Pennsylvania (2017-2020) which was closed and services integrated into other nearby facilities; UPMC Beacon Hospital in Dublin, Ireland (2009 to 2014) which was acquired by Irish businessman Denis O'Brien; UPMC Braddock in Braddock, Pennsylvania (1996 to 2010) which was closed; UPMC South Side hospital in Pittsburgh (1996 to 2009) which was merged with UPMC Mercy and converted into UPMC Mercy South Side Outpatient Center; UPMC Lee Regional in Johnstown, Pennsylvania (1998 to 2005) which was sold to Conemaugh Health System; and UPMC Beaver Valley in Aliquippa, Pennsylvania (1996 to 2001) which was transferred back to its community board and subsequently closed. UPMC Pinnacle Lancaster, formerly St. Joseph's hospital in Lancaster, Pennsylvania, closed on February 28, 2019, and its services were consolidated into UPMC Pinnacle Lititz."
Community engagement -> Center for Biosecurity at UPMC,"The Center for Biosecurity at UPMC (CBUPMC) is led by Thomas V. Inglesby, MD. Their mandate is to conduct ""independent research, analysis, and nonpartisan policy recommendations"" to serve as ""resources for decision makers who are responsible for strengthening US planning, response, and resilience to catastrophic events."""
Criticism and controversies,"UPMC has been criticized for excessive profits, monopolistic practices, excessive advertising budgets, and focusing on overseas operations at the expense of domestic ones. In addition, various controversies have received significant local and national attention in recent years. Over the last decade, it has often found itself the target of pointed criticisms from SEIU Healthcare, which has tried unsuccessfully to organize bargaining units among UPMC's service employees and other front-line workers.
In 2008, the administration and reporting of UPMC's living donor liver transplantation program received national attention when internal studies, spearheaded by transplant pioneer Thomas Starzl, questioned the safety of the procedure and ultimately resulted in the forced resignation of liver transplant program head, Amadeo Marcos.  Another controversy arose in May 2011 for UPMC's live-donor kidney transplant program when a kidney infected with hepatitis C was transplanted into a non-infected person. The incident led UPMC to voluntarily shut down its kidney transplant program for two months, and resulted in the suspension of a nurse and demotion of a surgeon. Federal reviewers with United Network for Organ Sharing concluded human error at fault for the oversight and corrective plans that included multiple redundancies were instituted with oversight from the Pennsylvania Department of Health. 
Because of the botched living donor kidney transplant at UPMC, the federal Organ Procurement Transplant Network (OPTN) put UPMC's transplant program on probation, a rarely used form of discipline handed down for some of the most serious transplant errors.
The OPTN said it meted out the discipline not only because of the kidney transplant error, but because UPMC's transplant program was found to have problems in its communication and documentation procedures before.
In April 2009, rival West Penn Allegheny Health System filed an antitrust lawsuit against the UPMC and health insurer Highmark, claiming a conspiracy to create a monopoly. The lawsuit was later dismissed with prejudice.  West Penn Allegheny filed an appeal of this judgment.  Upon appeal, the case was unanimously reinstated by the US Third Circuit Court of Appeals.
In October 2009, UPMC's administration decision to close UPMC Braddock hospital resulted in multiple protest and lawsuits by community groups who disputed UPMC's claims that the hospital was losing money and was underutilized.  The facility, now demolished in preparation for redevelopment, closed in January 2010.
In April 2013, UPMC has been criticized for paying low wages, and using unfair labor practices to thwart efforts by employees to unionize, as alleged in the Service Employees International Union's complaint to the National Labor Relations Board.
In March 2013, the City of Pittsburgh filed a lawsuit in Federal court challenging the tax exempt status of UPMC as a public charity, in an effort to make UPMC to pay back taxes. The city alleged that UPMC has abused its status to avoid paying property taxes. The city dropped its lawsuit in 2014.
In February 2019, the Pennsylvania Attorney General submitted legal actions against UPMC to enforce requirements for open health care access based on the non-profit status of UPMC.  These actions stem from a long-standing dispute between Highmark Health and UPMC, the largest two health-care providers in Western PA.  In 2011, Highmark entered a partnership with West Penn Hospital System (now Allegheny Health Network).  Because of this competitive threat, UPMC declared they would not accept Highmark Blue Cross Blue Shield Insurance.  In order to protect public access to health care while agreements between the two systems unwound, both UPMC and Highmark Health accepted a state-brokered consent decree. With the consent decree expiring in 2019, the Pennsylvania Attorney General attempted to negotiate continued access to care with both companies.  Highmark indicated that it would accept the terms while UPMC did not. It is the failure to accept the proposal that the PA Attorney General cited as leading to the legal actions of February 2019. UPMC then counter sued the Attorney General in federal court claiming his actions were ""anti-competitive"" and violate federal regulations and due process rights, while accusing him of ""intervening in a high-profile matter solely to advance his own political goals."" In June 2019, UPMC and Highmark reached a deal for a 10-year contract to maintain access across both health systems and all lawsuits that had been brought by the Attorney General, UPMC, and Highmark were subsequently dropped.
In 2021, the U.S. Attorney's Office filed a lawsuit against UPMC, University of Pittsburgh Physicians, and one of UPMC's top surgeons, alleging the surgeon was ""regularly scheduling multiple complex surgeries at the same time, forcing him to move between operating rooms and sometimes hospitals, while requiring patients to stay under additional hours of anesthesia."" In February 2023, UPMC agreed to pay the federal government $8.5 million to settle a lawsuit accusing them of ""knowingly submitting hundreds of false claims to Medicare, failing to follow medical standards for surgery and knowingly placing patients at risk."""
In popular culture,"The television medical dramas Heartland (2007) and Three Rivers (2009) were largely based on UPMC and the University of Pittsburgh's Thomas E. Starzl Transplantation Institute. In both cases the hospitals are fictionalized, but in the latter series UPMC is also specifically referred to as another Pittsburgh-area hospital."
Gallery,
